<?xml version="1.0" ?>
<!DOCTYPE drive SYSTEM "drive.dtd">
<!--
	Diese Datei enthält eine Liste von Mountpoints für ein virtuelles Laufwerk!
	Die enthaltenen Einträge dürfen auf keinen Fall geändert werden.

	This file contains a list of mount points for a virtual drive!
	The contained entries may not be changed at any case.
-->
<drive name="ipblock">
	<dir name="dir" filter=".cfg">
		<source>../../{$PROFILESDIR}</source>
		<requirements readable="yes" writeable="yes"/>
		<file name="whitelist.block">
			<source>../../{$PROFILESDIR}/{$ID}.whitelist</source>
			<requirements writeable="yes"/>
		</file>
		<file name="blacklist.block">
			<source>../../{$PROFILESDIR}/{$ID}.blacklist</source>
			<requirements writeable="yes"/>
		</file>
	</dir>
</drive>
